"Baby Boomer Professors Join Student Protests, Risking Arrest and Violence"
Israel Wants to Go Into Rafah. It’s Taking a Big Risk.
Buffett Lauds Apple After Berkshire Cuts Stake
Bondholders to Push Ukraine to Resume Debt Payments After Hiatus
"The Rocket Fuel Behind China Shock 2.0: Weak Currency, Deflation"
Investors Were Burned by European Banks for Years—Until Now
"Arizona Is Booming, but Restless Voters Feel Downbeat About Economy"
A Lawyer’s Slide Into Psychosis Was Captured in a WSJ Profile. He Tells Us His Story.
"The CEO Who Hired His Wife, Gave His Dog a Title, and Brought Down a Bank"
The Science Behind Why the World Is Getting Wetter
Capital-Gains Tax Hits More Home Sellers
Mystik Dan Wins the Kentucky Derby
The Delicate Art of ‘Shutting Up’ Donald Trump
Is This the Most Boring Man in the World?
Retailers Scale Back Self-Checkouts to Curb Irritation—and Theft
Texas Ban on ‘Woke’ Banks Opens Door for Smaller Firms
Ted Cruz Now Courts Democrats to Win Re-Election
Skip the Summer Crowds in Europe. Try These Underrated Destinations Instead.
‘Finance Bro’ Outfits Desperately Need an Update. We Have Fixes.
No More Sad Salads: The Dressing Rules and Ratios to Memorize Now
This Fifth-Generation Department Store Is Winning the Luxury Game
Inside Andy Cohen’s Reality
How One Record Store Is Riding the Vinyl-Revival Wave
‘Follow Your Dreams’ and Other Terrible Career Advice
The Wealthy Are Refusing to Sell Their Luxury Homes
Your Smart Home Is Driving Your Partner Bonkers. Here’s How to Fix It.
41 Unique Gifts for Women Who Have Everything
The 5 Best Water Flossers (for People Who Hate Flossing)
The Best Vanguard ETFs
TikTok Tells Advertisers It Won’t Back Down as U.S. Ban Looms
The Last Stock Photographers Await Their Fate Under Generative AI
Tech Spending Still Proves Thorny for Some Advertising Companies
"The AI-Generated Population Is Here, and They’re Ready to Work"
These Models Gave Up Photoshoots to Sell Their AI Likenesses
Oracle Looks to AI and Microsoft Partnership to Lift Cloud Business
Waste Management Boosts Profit Margins By Rerouting and Replacing Trash Trucks
Rates Staying Higher for Longer Could Mean More Big Goodwill Write-Downs Ahead
Auditors Balk at Regulator’s Push to Expand Their Role
"TikTok’s Push for Users to Lobby Congress Should Be Investigated, Lawmakers Say"
TD Bank Probe Tied to Laundering of Illicit Fentanyl Profits
The Morning Risk Report
Geopolitics Takes a Central Role in Supply Chains
Teamsters Canada Says Strikes at Railroads Could Begin May 22
Today’s Logistics Report: Geopolitics in Supply Chains; Europe Backs Factories; Leaving Baltimore
New Treasury Tax Guidelines Open Door for Corn and Soy in Sustainable Aviation Fuels
A Yeast-Like Bacteria Can Cut Carbon Emissions While Creating Sustainable Aviation Fuel and Sneakers
HSBC’s Green Credentials Come Under Fresh Scrutiny
Heard on the Street’s Stock-Picking Contest
The Economic Slowdown Is Finally Here. Welcome It.
Apple Buys Itself Some Time for an AI Boost
"Warren Buffett Talks Selling Berkshire’s Paramount Stake, Apple Stock at Berkshire’s Annual Meeting"
"‘We Lost Quite a Bit of Money.’ Berkshire Sold Entire Paramount Stake, Buffett Says."
The Poignant Moment When Warren Buffett Called for ‘Charlie’ at Berkshire’s Meeting
Betting on the Kentucky Derby? Here’s how to think like a professional handicapper.
Job gains were decent in April. But here’s what Biden really has to worry about.
SEC charges firm that audits Trump’s social-media company with ‘massive fraud’ affecting hundreds of filings
The Kentucky Town Where Affluent Home Buyers Find Pastoral Beauty and Large Lots
"A Spaceship-Like Texas House, a Big-Ticket Beach Home Outside L.A. and More"
Hollywood Home Actor Matthew Perry Bought Months Before His Death Lists for $5.195 Million
Stressed-out Transplants Are Finding Refuge in This Costa Rica Getaway
"Interest in EVs Is Down as Charging Logistics Hinder Consumers, WSJ Study Finds"
"Texas Oil Dynasty Selling 6,000-Acre Corpus Christi Ranch for $29.95 Million"
The Ultimate Home Maintenance Checklist
Banks vs. Credit Unions: How to Choose
The Best Silk Pajamas That Feel Luxe and Comfy
‘529’ Plans Are Getting a Lot More Flexible—and Useful—This Year
Worried About a Stock-Market Correction? Here’s How to Lock in Recent Gains
‘Sell in May and Go Away’ Isn’t as Useful as It Once Was
Buffett Fears AI Has ‘Enormous Potential for Harm’
A Lawyer Abandoned Family and Career to Follow the Voices in His Head
How to Avoid Everything From Ruined Vacations to Renovation Regrets
IPO Investing Is Risky. Here’s How to Find the Likeliest Winners.
Questions Potential Business Partners Should Ask Themselves
    
What exactly goes into closing costs?
Warren Buffett holds first Berkshire Hathaway meeting without Charlie Munger
They have jobs but still need help to feed their families
Why do brown eggs cost more than white eggs? Blame the bird
"The US economy added just 175,000 jobs last month and unemployment rose to 3.9%"
Stocks close higher after softer-than-expected jobs report fuels hopes of an earlier rate cut
Trump Media’s accounting firm charged with ‘massive fraud’
"US job market shows signs of cooling, with just 175,000 jobs added in April"
Columbia’s administrators failed crisis management 101
The company that rebuilt Genoa bridge is offering to do the same for Baltimore
"Rue21, a mall staple, files for bankruptcy and will close all of its stores"
What’s at stake in the Google antitrust case? Billions of dollars (and the way we use the internet)
Turkey halts trade with Israel over Gaza war
What went wrong at Red Lobster
Patience wears thin at ABC News as frustrated staffers wonder when Disney will make leadership changes
"Boeing has lost $32 billion since 2019, with no end in sight. How long can it keep losing money?"
Restaurants are competing for frugal diners’ dollars
Truth Social keeps shrinking despite the Trump trial and looming election
Strawberry shortcake and foreign travel: How the yen’s record slump is squeezing the Japanese
Russia’s Gazprom posts first annual loss in 20 years as sales to Europe collapse
American oil tycoon accused of trying to conspire with OPEC to inflate prices
Eight tons of ground beef sold at Walmart locations nationwide recalled for possible E. coli contamination
Apple plans record $110 billion share buyback amid challenging earnings report
CARE CEO fights global poverty
Is ‘giving back’ in your work ethic?
Riding South Africa’s EV boom
Coastal life and ranches: A different side to Abu Dhabi
Dating app Bumble will no longer require women to make the first move
Americans’ pay gains rose faster than expected so far this year
Volkswagen’s electric car orders double in Europe
Walmart will close all of its health care clinics
Hong Kong stocks are back from the dead. Here’s why
Less choice and higher prices? Britain braces for Brexit checks on food imports
Samsung reports enormous jump in profit on AI boom
US regulators investigate fatal crashes involving Ford’s Blue Cruise hands-free driving technology
Stephen Colbert berates Kristi Noem for killing her dog
Weaving the future of South Africa’s wool industry
"‘If you can afford to buy, you always buy,’ says Suze Orman"
Salad restaurant shows CNN why it scans its employees’ hands
This glass could turn skyscrapers into power generators
How to make high interest rates work for your hard-earned savings
"The average Wall Street bonus dipped 2% last year, to $176,500"
"The average tax refund is over $3,000. Here are 7 ways to put it to good use"
March 12 marks Equal Pay Day this year
FTC investigating TikTok over privacy and security
Apple announces its annual developers conference is set for June 10
Judge’s stern rebuke of Elon Musk’s X gives researchers fresh hope
3 ways Apple’s monopoly lawsuit could change the iPhone experience for fans
"NBC cut ties with Ronna McDaniel after extraordinary pressure, but its problems aren’t over"
NBC News ousts Ronna McDaniel after network’s anchors launch unprecedented on-air rebellion
NBC News boss Cesar Conde faces backlash from his network’s anchors over ‘inexplicable’ decision to hire ex-RNC chair Ronna McDaniel
"NBC hires former RNC chair Ronna McDaniel, who has demonized the press and refused to acknowledge Biden was fairly elected"
"10 great ways to travel for free with 75,000 Chase Ultimate Rewards points"
"Bilt’s May Rent Day promotion: Redeem points toward rent, get free home decor"
Your ultimate guide to the American Express Membership Rewards program
It’s back: Targeted Amex card holders can get up to 30% off at Amazon
Digital humans: the relatable face of artificial intelligence?
Top soccer clubs are using an AI-powered app to scout future stars
Why lab-grown diamond sales are surging
The Chevrolet Corvette is officially going electric
OpenAI’s wild week. How the Sam Altman story unfolded
Sam Altman returns to OpenAI in a bizarre reversal of fortunes
Opinion: The drama around Sam Altman is an urgent warning
Microsoft stock hits all-time high after hiring former OpenAI CEO Sam Altman
    
"Buffett talks Apple, AI, Paramount, and more at Berkshire meeting"
Buffett says taxes may rise to offset widening US deficits
Buffett says Berkshire sold entire Paramount holdings at a loss
TikTok ban will accelerate the 'splinternet'
Worsening weather is igniting a $25 billion market
Souring profit outlooks threaten S&P 500's 20% rally
UAW workers ratify US labor deal with Daimler Truck
United Auto Workers ratify contract with Daimler Truck
It’s Florida season
Australia Pledges to Slash About $2 Billion From Student Debt
Paramount bidders await word from special committee evaluating options
How Western Sanctions Are Strangling Putin’s Arctic Gas Ambitions
Yellen Counsels Caution on Currency Intervention After Yen Surge
"Everton FC Buyer Accused of Fraud, Double-Pledging Assets in Lawsuit"
Berkshire's profit plunges 64% on portfolio holdings as Buffett sells Apple
"The US could give homeowners a $980 billion stimulus at no additional cost, 'Oracle of Wall Street' says"
Here's the 1 Stock Warren Buffett Thinks Should Outperform the S&P 500 Without as Much Downside
Warren Buffett says Berkshire sold entire Paramount stake at a loss
"Berkshire shareholders reject climate, diversity, China proposals"
Analyst Report: Berkshire Hathaway Inc.
This Dividend Stock Yields 4.4% and Has 15 Consecutive Years of Dividend Increases. Here's Why It's a Buy Now
A 64-year-old 'peak boomer' worries his savings and Social Security won't be enough to retire: 'My biggest fear is finding myself at 75 standing at the door at Walmart.'
    
